Headline,Description,Time,Category,SourceFile
Is Piastri now favourite for drivers' title?,BBC Sport F1 correspondent Andrew Benson answers your questions following the Bahrain Grand Prix.,3 hrs ago,Formula 1,article_37_news.html
Watch from launch to landing: All-female crew travels into space,"The flight, carrying celebrities like Katy Perry and Gayle King, reached a height of about 60 miles (96.6km) above Earth.",18 hrs ago,US & Canada,article_23_news.html
Trump blames Zelensky for starting war after massive Russian attack,"The US president said that you ""don't start a war against someone 20 times your size"" and hope people give you missiles.",6 mins ago,World,article_16_news.html
Couple arrested for breeding exotic cats in Spain,"The couple is suspected of selling exotic cats online, including protected species such as white tigers.",11 hrs ago,Europe,article_31_news.html
Was China the reason Guyana faced higher Trump tariff?,"A Guyanese political commentator says Washington objects to Beijing's ""very strong foothold"" in the country.",1 day ago,Business,article_8_business.html
How much vital UK infrastructure does China own?,BBC Verify looks at what we know about the extent of Chinese investment in the UK economy.,16 hrs ago,BBC Verify,article_25_news.html
Police say Pennsylvania arson suspect would have attacked governor,Authorities are still investigating a possible motive as the suspect's mother says he suffered from mental health issues.,6 hrs ago,US & Canada,article_28_news.html
Could Rory McIlroy become Europe's greatest golfer?,"Rory McIlroy's Masters win puts him in the pantheon of golfing greats and as the first European to complete the feat, in the conversation to be considered the continent's greatest ever, writes Iain Carter.",4 hrs ago,Golf,article_22_news.html
Fury will never fight again - Arum,Bob Arum - who promoted Tyson Fury for years - does not think fans should expect a comeback from the retired heavyweight.,40 mins ago,Boxing,article_36_news.html
China's Xi urges Vietnam to oppose 'bullying' as Trump mulls more tariffs,Trump called Xi's meeting with Vietnamese leaders a ploy to figure out how to 'screw' the US.,30 mins ago,Asia,article_17_news.html
"Good cops, bad cops - how Trump's shifting tariff team kept world guessing","Competing voices from the White House fuelled uncertainty before the president announced a sweeping pause, experts say.",11 hrs ago,US & Canada,article_2_business.html
World of Business,"Gain the leading edge with global insights for the boardroom and beyond, in your inbox every Wednesday.",N/A,N/A,article_6_business.html
World of Business,"Gain the leading edge with global insights for the boardroom and beyond, in your inbox every Wednesday.",N/A,N/A,article_1_business.html
"Good cops, bad cops - how Trump's shifting tariff team kept world guessing","Competing voices from the White House fuelled uncertainty before the president announced a sweeping pause, experts say.",11 hrs ago,US & Canada,article_24_news.html
Trump threatens new tariffs on smartphones days after exempting them,"President Trump says Chinese-made electronics are simply moving to a different levy ""bucket"".",22 hrs ago,World,article_5_business.html
"Keir Starmer paid $72,285 in tax last year","The prime minister, his deputy and the chancellor publish summaries of their taxes for 2023/24.",15 hrs ago,Politics,article_30_news.html
Analysis: Trump's iPhone olive branch is a significant trade war retreat,Exempting electronics from US tariffs is a stunning about-turn by the Trump administration after 10 days of chaos.,2 days ago,Business,article_10_business.html
Watch: JD Vance drops college football trophy at White House ceremony,The Ohio State Buckeyes team was invited to meet President Donald Trump to celebrate the team's title-winning season.,12 hrs ago,US & Canada,article_29_news.html
The Taliban banned Afghan girls from school. Low-paid carpet weaving is now their lifeline,The BBC speaks to young women who are now working to support their families in one of few jobs they are allowed to do.,4 hrs ago,Asia,article_14_news.html
Mark Zuckerberg defends Meta in social media monopoly trial,The US government is seeking to break up Meta by forcing a spinoff of Instagram or WhatsApp.,8 hrs ago,US & Canada,article_4_business.html
"PSG's Doue, the teenager who is the talk of Europe","PSG teenager Desire Doue has gone from a false start to the talk of European football, says BBC Sport's chief football writer Phil McNulty.",4 hrs ago,European Football,article_35_news.html
"Good cops, bad cops - how Trump's shifting tariff team kept world guessing","Competing voices from the White House fuelled uncertainty before the president announced a sweeping pause, experts say.",11 hrs ago,US & Canada,article_0_business.html
How much vital UK infrastructure does China own?,BBC Verify looks at what we know about the extent of Chinese investment in the UK economy.,16 hrs ago,BBC Verify,article_21_news.html
The Taliban banned Afghan girls from school. Low-paid carpet weaving is now their lifeline,The BBC speaks to young women who are now working to support their families in one of few jobs they are allowed to do.,4 hrs ago,Asia,article_19_news.html
'I can't keep up': Trump's changing tariffs leave shoppers feeling paralysed,The rapid change of Trump's tariff policy has shoppers wondering if they should stock up or just wait this out.,2 days ago,US & Canada,article_11_business.html
Is Piastri now favourite for drivers' title?,BBC Sport F1 correspondent Andrew Benson answers your questions following the Bahrain Grand Prix.,3 hrs ago,Formula 1,article_33_news.html
Couple arrested for breeding exotic cats in Spain,"The couple is suspected of selling exotic cats online, including protected species such as white tigers.",11 hrs ago,Europe,article_27_news.html
UK takes control of British Steel under emergency powers,"Business Secretary Jonathan Reynolds says nationalisation is ""likely"" next step as Parliament rushes law through.",3 days ago,Politics,article_12_business.html
'A stab in the back' - car workers in Canada hit out at US over tariffs,"The car industry in Windsor, Ontario, has employed generations of Canadians but now the future is uncertain.",1 day ago,US & Canada,article_7_business.html
"'Good chance' of US-UK trade deal, says Vance",The Trump administration's trade policy shakeup has caused global economic turmoil.,10 mins ago,US & Canada,article_3_business.html
Trump freezes $2bn in Harvard funding after university rejects demands,"The White House sent a sweeping list of requirements to the university last week, which it said were aimed at fighting antisemitism.",50 mins ago,US & Canada,article_15_news.html
No 10 'confident' British Steel furnaces will stay on,"Vital materials stored nearby to the Scunthorpe plant will arrive in the ""coming days"", Downing Street says.",15 hrs ago,UK,article_9_business.html
Could Rory McIlroy become Europe's greatest golfer?,"Rory McIlroy's Masters win puts him in the pantheon of golfing greats and as the first European to complete the feat, in the conversation to be considered the continent's greatest ever, writes Iain Carter.",4 hrs ago,Golf,article_20_news.html
'McIlroy in the conversation to be Europe's greatest golfer',"Rory McIlroy's Masters win puts him in the pantheon of golfing greats and as the first European to complete the feat, in the conversation to be considered the continent's greatest ever, writes Iain Carter.",4 hrs ago,Golf,article_34_news.html
The Indian airport that halts flights for a divine procession,"Twice a year, the Thiruvananthapuram airport shuts operations for a few hours for a temple procession.",2 hrs ago,Asia,article_18_news.html
Police say Pennsylvania arson suspect would have attacked governor,Authorities are still investigating a possible motive as the suspect's mother says he suffered from mental health issues.,6 hrs ago,US & Canada,article_26_news.html
'McIlroy in the conversation to be Europe's greatest golfer',"Rory McIlroy's Masters win puts him in the pantheon of golfing greats and as the first European to complete the feat, in the conversation to be considered the continent's greatest ever, writes Iain Carter.",4 hrs ago,Golf,article_32_news.html
Trump freezes $2bn in Harvard funding after university rejects demands,"The White House sent a sweeping list of requirements to the university last week, which it said were aimed at fighting antisemitism.",50 mins ago,US & Canada,article_13_news.html
